{"attempt_store":"/var/lib/ag-effectd-m1a/attempts.sqlite","effect":{"action":"start","expected_active_state":"inactive","expected_unit_file_state":"disabled","kind":"systemd_unit","target":"constellation-beta-http-fixture","unit":"constellation-beta-http-fixture.service"},"effect_index":0,"execution_lock_timeout_ms":5000,"file_policy":{"max_content_bytes":1024,"require_private_parent_writes":true,"trusted_ancestor_uid":0,"trusted_parent_uid":0},"job_timeout_ms":30000,"schema":"ag-effectd.docket-executor-systemd-plan/v2","scope":"sha256:8af637fa343a1e1968c2e4f0a44141208d5c17205ae73de883a760c8115e8ced","subject":"sha256:c3c44b229a2e14197eccef0c774c46f438fbe2aef80925498c5cdcd4eb13de47","systemd_machine_identity":"bb1aa44ac2984af89f6d3ac865cd0004"}
